Empresa,Email,Teléfono,Sitio Web
AutoConsumo,info@todomantenimientos.es,931 190 852,http://autoconsumoenbarcelona.com
Compara precios y ofertas de paneles solares e instala al mejor precio,kristian@nettbureau.no,997104854,https://placassolares.es
Directorio de Instaladores de Placas Solares en España,,612.636.282,https://www.instaladoresdeplacassolares.es
Directorio de mejores empresas de Madrid,tu@email.com,644 156 757,https://madrid.place
El mejor comparador de instaladores de placas solares para tu casa,info@comparasolar.com,653002849,https://comparasolar.com
Energía solar en Barcelona con soluciones de autoconsumo eficiente.,info@solarup.es,999999998,https://solarup.es
Evaluador independiente de instaladores solares en España,tu@email.com,,https://miautoconsumo.com
Instalación Placas Solares Madrid,info@solarsoul.es,602 070 215,https://solarsoul.es
Instaladores de Placas Solares en Barcelona,solar@preinsta.com,933 457 162,https://placassolaresautoconsumo.barcelona
Mejores Instaladores de Placas Solares en España ☀️ 2026,info@mejoresinstaladoressolares.com,694.625.712,https://mejoresinstaladoressolares.com
POWEN,Imagen-Formas-de-pago-desktop-V2@2x-245x300.png.webp,674936308,https://powen.es
Placas solares en 2025,46@2x.webp,,https://solarplus.es
SolarHogar,tu@email.com,,https://solarhogar.es
Solarweb.net,,953 1447.79,https://www.solarweb.net
Voltura Projects,info@volturaprojects.es,640801491,https://volturaprojects.es
