Empresa,Razón Social,CIF,Email,Teléfono,Sitio Web,Dirección,Provincia,LinkedIn,Facebook
Instalación Placas Solares En Galicia,,,,+34 639 05 75 37,https://north-solar.es,,A coruña,,
Reparaciones Mahico · Servicios 24 Horas · Profesionales,"Mahico Soluciones, S.l",B98159940,,,https://www.mahico.com,,A coruña,,
Instalación De Placas Solares En Coruña,,,,+34 774 29 93 13,https://placassolarescoruna.es,,A coruña,,
Instalaciones Fotovoltaicas En Galicia,Es: Solar Galaica Sociedad Civil,J01842202,,+34 623 19 11 49,https://solargalaica.com,"Li>mi Domicilio Social Se Encuentra En Rua Torres, 12 – Oleiros (15173) – A Coruña. Email: Solargalaica@gmail.com <l",A coruña,,
Energía Solar Y Electricistas En España (,,,,+34 728 14 03 62,https://novaesfera.es,,Albacete,,
Instalaciones Solares Fotovoltaicas,Anbelo Solar Sl,B02387280,,+34 967 55 05 68,https://www.anbelosolar.com,,Albacete,https://www.linkedin.com/company/anbelo-solar-sl/,https://www.facebook.com/anbelosolar
Energía Fotovoltaica En Albacete,,,,+34 999 99 99 99,https://www.armerosolar.com,,Albacete,,https://www.facebook.com/profile.php?id=61565414301585
Energía Solar En Albacete,,,,+34 673 56 20 18,https://solab.es,,Albacete,,
Placas Solares En Albacete,,,,+34 677 47 67 17,https://www.segurasolar.com,,Albacete,,
Placas Solares En España,,,,+34 999 99 99 99,https://instaladoresplacas.com,,Albacete,,
Evaluador Independiente De Instaladores Solares En España,,,,,https://miautoconsumo.com,Nversores Integrados En Los Kits Cumplen Con La Normativa Une-en 50549-1 Y Llevan Protecciones Anti-isla (se Desconectan Automátic,Albacete,,
Placas Solares En España,Typeform Sl,,,+34 612 63 62 82,https://www.instaladoresdeplacassolares.es,,Albacete,,
Solarhogar,,B98407901,,,https://solarhogar.es,"B98407901 Domicilio Social: Ptda Cortixelles 89, 46900 Torrent (valencia), España Registro Mercantil:<",Albacete,,
Compara Precios Y Ofertas De Paneles Solares E Instala Al Mejor Precio,"Autoconsumo Fotovoltaico Y Renovables, S.l",,,+34 997 10 48 54,https://placassolares.es,,Alicante,,
Placas Solares Alicante,Thermacción S,B42649889,,+34 611 54 30 39,https://www.thermaccionsolar.com,,Alicante,,
Placas Solares En Alicante,,,,+34 963 82 20 85,https://placasolaresalicante.es,,Alicante,,
Placas Solares En Alicante,Es: Jesús Arteaga Fernández (en Adelante Jesú,,,+34 782 10 49 34,https://placassolaresalicante.com,"Ong> Carrer Mestre Latorre, 2, 03005 Alacant, Alicante Teléfono: <p",Alicante,,
Empresa De Energía Solar Y Renovable Alicante,"A Solar, S.l.",B54006663,,+34 966 50 12 78,https://tecnovasolenergia.com,"Domiciliada En C/ Literato Azorín, 1, Cocentaina, 03820, Alicante. Y Con Cif B54006663, Con Teléfono D",Alicante,https://es.linkedin.com/company/tecnovasol-energia-solar-slu/,https://www.facebook.com/tecnovasolenergia
Tu Instalador Solar En Alicante,"Soluciones Corporativas Ip, S.l",,,+34 999 99 99 99,https://energiasolaralicante.es,"O), Con Domicilio Social En Ronda Del Carme, Nº 8, 5ºb, 27004 Lugo. Se Puede Consultar La Política De Privacidad Y Demás",Alicante,,
Solalicante Empresa Instalación Placas Solares En Alicante,Sol Y Area Energeticas Sl,B72909997,,,https://solalicante.es,,Alicante,https://www.linkedin.com/in/javier-díaz-gonzález-1872a9135/,
Instalación Placas Solares Alicante ※ Solarea Tech,"Sol Y Area Energeticas, Sl",B72909997,,+34 958 30 49 58,https://www.solareatech.com,,Alicante,https://www.linkedin.com/company/solarea-tech/,https://www.facebook.com/people/Solarea-Tech/100089855888147/
"Empresas, Ofertas Y Tiendas En Alicante",,B85753614,,+34 910 14 98 22,https://alicante.infoisinfo.es,"Dencias, Con Domicilio En Calle Alejandro González, 5. Cp 28028 Madrid. (españa). 8. Ind",Alicante,,https://www.facebook.com/infoisinfoES
Crusol,,B30929483,,+34 698 94 87 88,https://www.crusol.com,"R23301764gcrusol Proyectos E Instalaciones Slc/ Berlin 3f 1.14cp 30353 Cartagenab30929483info@c""> <meta Name=""twitter:image"" Conte",Alicante,https://www.linkedin.com/company/crusol/,https://www.facebook.com/crusole
Placas Solares En Alicante,,B42814327,,+34 622 78 56 72,https://corenergia.com,">dirección: Clara De Campoamor, 14 Bw 4 – 03540, Alicante, España Teléfono De Contacto",Alicante,,https://www.facebook.com/Placassolaresalicante
Inicio,Girasol Energia Sl,B42704940,,+34 681 64 34 53,https://girasolenergia.com,,Alicante,,https://www.facebook.com/girasolenergiaalc
"Placas Solares En Almería, Roquetas, El Ejido",Gestion Energetica Sol Almeria Sl,B04907150,,+34 950 53 06 84,https://www.solalmeria.com,,Almeria,,
🔒 Albedosolar.com,,,,+34 658 11 74 86,https://albedosolar.com,,Almeria,,
Sunfields,Sfe Solar Logistic S.l,B70251038,,+34 981 59 58 56,https://www.sfe-solar.com,Parallax Issue On Safari Https://core.trac.wordpress.org/ticket/48802 Https://core.trac.wordpress.org/ticket/49285 Https://github,Almeria,https://www.linkedin.com/company/sunfields-europe,https://www.facebook.com/sunfieldseurope
Paneles Solares En Almerã­a,,,,+34 926 35 42 70,https://www.yndalo.es,"O Social En Calle Bayarque Sn Poligono La Mezquita Almerã­a C.p: 04007, Espaã±a. Si Tiene Cualquier Duda Sobre El Tratamiento De",Almeria,https://www.linkedin.com/in/yndalo-solar-solar-energy-783220271/,https://www.facebook.com/profile.php?id=100010073686151
Solarenter,,,,+34 697 22 98 63,https://solarenter.com,"Lante, “solarenter”) Cif: 27492953h C. Varadero, 20, 04770 Adra, Almería Si Tienes Alguna Pregunta O Inquietud Sobre N",Almeria,,
Vector Solar,,,,+34 961 19 21 92,https://vectorsolar.es,Svg'%3e%3cpath Fill-rule='evenodd' Clip-rule='evenodd' D='m4 0c4.26522 5.96046e-08 4.51957 0.105357 4.70711 0.292893l7.70711 3.292,Almeria,https://es.linkedin.com/company/vectorsolar,https://www.facebook.com/p/Vector-Solar-61553327680996/
Placas Solares En Almería. Sdn Solar,,,,+34 950 88 05 05,https://www.sdnsolar.es,,Almeria,,
Energía Solar Almería,,,,+34 960 00 11 22,https://almeria.es.solar,,Almeria,,
Asesoría Energética,Energy Tricolor Sl (en Adelante,B04914990,,+34 958 30 49 58,https://energytricolor.com,,Almeria,https://www.linkedin.com/company/energy-tricolor/,https://www.facebook.com/rinnovoenergia.cantoria
Imelect Energía Solar,Imelect Electricidad Y Renovables S.l,B04776480,,+34 950 08 15 26,https://imelect.es,,Almeria,https://es.linkedin.com/company/imelect,https://www.facebook.com/ImelectEnergiaSolar
Instalar Placas Solares Jaén,Naturaleza Climatica S.l,B18689026,,+34 953 96 02 00,https://www.aficlima.com,"Address""> C/ Escañuela 52, 23009 Jaén | C/ Cap",Almeria,,https://www.facebook.com/Aficlimasolar/
Sotysolar: Instaladores De Placas Solares,"Be Energy Part, S.l",B52536729,,+34 911 43 67 36,https://sotysolar.es,"An> Cam. De Villaviciosa, °18, 28600 Navalcarnero, Madrid",Asturias,https://es.linkedin.com/company/sotysolar,https://www.facebook.com/sotysolar
Instalación Placas Solares En Asturias,,,,+34 984 26 35 70,https://caminsolar.com,,Asturias,,
Paneles Solares En Asturias,Gamo Solar Sl,B56877855,,+34 611 57 71 88,https://gamosolar.es,"""addresslocality"": ""avilés"", ""postalcode"": ""33401"", ""addressregion"": ""asturias""",Asturias,https://www.linkedin.com/company/gamo-solar/,
Paneles Solares Asturias,"Econor Efficiency, S.l",B52556537,,+34 985 34 19 20,https://ecosolarcantabrico.com,"> C.i.f. Nº B52556537 Domicilio: C/ Dindurra 13, Bajo. 33202 Gijón . Asturias. Responsable: Humberto C. López",Asturias,https://www.linkedin.com/company/70928145/,https://www.facebook.com/ecosolarcantabrico/
Guía De Servicios De Es Aquí: Guía De Servicios Locales En Tu Ciudad,,B85530947,,+34 902 90 75 04,https://www.esaqui.es,"S.l. B-85530947 Calle Del Cristo 19, 48007 - Bilbao (bizkaia) Datos Registrales: Se Encue",Asturias,,
Ecoenergia Asturias ¡únete Al Autoconsumo!,Para La Eficiencia Energetica Sl,B10756807,,+34 601 46 21 80,https://ecoenergiaasturias.com,Com/wp-content/themes/salient/css/salient-dynamic-styles.css?ver=13634' Media='all' /> #header,Asturias,https://www.linkedin.com/company/ecoenergiaasturias,https://www.facebook.com/Ecoenergiaasturias
Voltivi Empresa De Instalación De Placas Solares En Asturias,Voltivi Slu,B70938758,,+34 637 73 58 73,https://www.voltivi.es,"P Style=""text-align: Justify;"">dirección: Calle Mercado 8, Bajo, 33300, Villaviciosa, Asturias <p Style=""text-align: Justify",Asturias,,
Diespo Energy,,B52579380,8eb368c655b84e029ed79ad7a5c1718e@sentry.wixpress.com,+34 667 70 46 70,https://www.diespoenergy.com,,Asturias,,
❱ Instalación Y Reparación De Placas Solares En Ávila,,,,+34 999 99 99 99,https://solar-avila.com,,Avila,,
Nordisk.es Â Quotes From Verified Companies,Nordisk Invest Sl,B19719335,,+34 654 94 60 46,https://nordisk.es,">registered Address: Calle Pez Dorado, 42 Bj A, 29620 Torremolinos, Mã¡laga, Spain <strong",Avila,,https://www.facebook.com/profile.php?id=61589937127454
Solar Iglesias,,,,+34 920 38 03 32,https://solariglesias.com,"Trong>direccióncalle Rosarito, 6 Bis, Candeleda05480 Ávila",Avila,,https://facebook.com/instalacionesiglesias
Empresa De Servicios Energéticos Sostenibles,,B88635222,,+34 615 90 05 33,https://www.natural-home.es,"Nif: B88635222 Domicilio: C/ Jerez, 3, 28016 - Madrid (madrid) ‍ Con Los",Avila,https://www.linkedin.com/company/natural-home-spain/,
Inicio,"Instalaciones Fonycale, S.l.",B05201330,,+34 999 99 99 99,https://jjgalan.com,"Nycale, S.l.u. Nif/cif: B05201330 Dirección: Calle Eras 10 2º A, 05002 Ávila (ávila) Correo: Jdavid_jdgs@hotmail.com Finalidad Se",Avila,,https://www.facebook.com/profile.php?id=100065137445180#
"Electricidad Peral, Tu Electricista En Ávila",,,,+34 699 53 51 58,https://electricidadperal.com,,Avila,,
Tu Equipo De Marketing Digital,Qdq Media Sau,A81745002,,+34 900 10 03 14,https://www.qdq.com,,Avila,https://www.linkedin.com/company/qdq/,https://www.facebook.com/qdqoficial
Instalación Placas Solares Madrid,Solarsoul Consulting Sl,B26737684,,+34 602 07 02 15,https://solarsoul.es,,Avila,,
Placas Solares En Extremadura,,B44689792,,+34 623 38 26 84,https://aurosolar.es,,Badajoz,https://www.linkedin.com/company/auro-solar,https://www.facebook.com/aurosolarenergia
Placas Solares Badajoz,,,,+34 696 97 87 57,https://www.extresolar.com,,Badajoz,,
Placas Solares En,,,,,https://solarplus.es,,Badajoz,https://www.linkedin.com/company/solarplus-es/,https://www.facebook.com/SolarPlus.es
Placas Solares Y Aerotermia En Extremadura,,B09903329,,+34 637 71 22 80,https://energiaycalorextremadura.es,"Polã­gono Cerro De San Francisco, Calle Tres10500 Valencia De Alcã¡ntara (cã¡ceres",Badajoz,,https://www.facebook.com/EnergiaYCalorExtremadura/
Placasolar.info,United Gestion Jmr S.l,B88186598,,+34 688 82 13 26,https://placasolar.info,Placasolar.info Domicilio Social: Henri Dunant 15-17 28036 Madrid Cif / Nif: B88186598 Teléfono: 68881174,Badajoz,,https://www.facebook.com/PlacaSolar.info
Energía Solar Badajoz,,,,+34 999 99 99 99,https://eme-solar.es,,Badajoz,,
Quiero Sol,,,,+34 771 13 07 91,https://quierosol.com,"Real Decreto-ley 18/2022, De 18 De",Baleares,,https://www.facebook.com/solar.quierosol
Paneles Solares En Baleares · Ahorra Hasta 70% · Solares Mallorca,Tecnicista Sl,B70815402,,+34 694 62 57 12,https://solaresmallorca.es,"Rong>domicilio Social: C/antoni Maria Alcover 15, 3ºa · 07011 Palma De Mallorca, Illes Balears (españa) <stron",Baleares,,
Placas Solares En Mallorca,,,,+34 644 11 96 19,https://mallorca.es.solar,,Baleares,,
Placas Solares En Mallorca,Uep Green Commodities S.l,B56503899,,+34 697 77 07 97,https://www.uep.solar,,Baleares,https://www.linkedin.com/company/uep-solar/,https://www.facebook.com/profile.php?id=100075642484958
Solsulet,,B16607269,,+34 958 30 49 58,https://www.solsulet.com,"Ng> C/ Pedro Francés, Num. 9, Planta 2, Puerta 201 07800-ibiza (baleares) O Mediante Correo Electrón",Baleares,,https://www.facebook.com/people/SolSulet/100063625898192/#
Instaladores Placas Solares Mallorca,Solarta Balear Slu,B07891021,,+34 971 83 53 33,https://www.solarta.com,"Ciubn7"" Rel=""nofollow"" Target=""_blank"">avinguda Dels Pujols, 13, 07570 Artà. Illes Balears",Baleares,,
Energía Solar Fotovoltaica En Mallorca,Ener Energies Renovables De Les Illes Balears Sl,,,+34 971 76 18 70,https://www.g-ener.com,,Baleares,https://www.linkedin.com/company/5019738,https://www.facebook.com/generrenovables
Instalación De Energía Solar Fotovoltaica En Mallorca,,,,+34 971 59 39 74,https://www.balearfotovoltaica.org,87 0 01-35.9 6.46c-47.32 0-88.54-32.55-88.54-74.32a31.48 31.48 0 01117.13 105c-42.8 1.8-53.8 46.4-53.8 72.53 0 73.88 68.09 81.37 8,Baleares,,
Placas Solares En Mallorca,Totsol Soluciones Solares Sl,B72965189,,+34 623 28 79 67,https://tot-sol.com,"Otsol Soluciones Solares Sl. Calle Rafael Alberti, Nº79, – 07300 Inca (illes Balears). E-mail: Info@tot-sol.com <p Cl",Baleares,,https://www.facebook.com/Totsolmallorca
Energã­a Solar En Baleares,,V83261744,,+34 673 17 22 76,https://aptsolar.es,"Www.w3.org/2000/svg\""><path D=\""m24 12.0726c24 5.44354 18.629 0.0725708 12 0.0725708c5.37097 0.0725708 0 5.44354 0",Baleares,,https://www.facebook.com/
Mejor Empresa De Energías Renovables Barcelona,,,,,https://seorenovables.es,,Barcelona,,
Mejores Empresas De Barcelona,,,,+34 644 15 67 57,https://barcelona.place,"Dirección: C/montmatre 10, 2, 5c, 29620 Torremolinos (málaga",Barcelona,,
"Energía Solar, Aerotermia Y Baterías En España",,,,,https://www.tuenergiaverde.es,,Barcelona,,
Topservices Â Encuentra Los Mejores Profesionales En Espaã±a,,,,+34 646 20 08 77,https://topservices.es,,Barcelona,,
Instaladorsolar.eu,,,,+34 694 62 57 12,https://instaladorsolar.eu,"Meta Property=""og:image"" Content=""https://pps.whatsapp.net/v/t61.24694-24/710468019_874929111583260_7264645603118070682_n.jpg?ccb=",Barcelona,https://www.linkedin.com/in/albertotamayo,
Placas Solares En Barcelona,Lampisteria Preinsta Sl,B61864245,,+34 933 45 71 62,https://placassolaresautoconsumo.barcelona,"A Sl (cif B61864245), Con Domicilio En C/ Malats 48-50 Tienda 2, 08030 Barcelona (españa).contacto Electrónico: (debe Incluirse El",Barcelona,,
Energía Solar En Barcelona Con Soluciones De Autoconsumo Eficiente.,,,,+34 999 99 99 98,https://solarup.es,,Barcelona,https://www.linkedin.com/company/solarup-in/,https://www.facebook.com/In.SolarUp
Refórmamelo,,,,+34 647 70 87 07,https://reformamelo.com,,Burgos,,
"Empresa Instaladora De Placas Solares, Solar360 De Repsol Y Movistar","Solar360 De Repsol Y Movistar, S.l",B10793719,,+34 600 40 03 00,https://www.solar360.es,"""false"" Aria-haspopup=""false"" Data-drupal-link-system-path=""node/19375"">plan Inteligente Solar360",Burgos,https://www.linkedin.com/company/solar360-repsol-movistar,https://www.facebook.com/Solar360.es
Instalación De Placas Solares En León,,,,+34 630 94 95 15,https://placasolaresleon.com,,Burgos,,
Empresa De Energías Renovables En Logroño,,,,+34 643 10 55 26,https://masquesolar.com,,Burgos,,
Inicio,,,,+34 982 13 27 08,https://ldsolar.es,,Burgos,https://www.linkedin.com/company/ld-solar-soluciones-fotovoltaicas/,https://www.facebook.com/LD-Solar-110435738693365
Empresa De Energía Solar Burgos,: Juan Fernando Hurtado Moar Dirección De La,,,+34 639 71 26 82,https://energiasrenovablesonline.net,,Burgos,,
Burgosolar Energia Fotovoltaica,"Fotovoltaica, S.l",B06948194,,+34 653 90 38 31,https://burgosolar.es,"Avda. Castilla Y León, S/n Trasera Plaza Cádiz, Nº 8 09007 Burgos Info@burgo",Burgos,http://linkedin.com/in/h%C3%A9ctor-palomo-renes-71347b9a,https://www.facebook.com/BurgoSolar-101802131690512/
Norsol – Energía Solar – Especialistas En Energía Solar Fotovoltaica Para Empresas,,,,+34 747 22 33 52,https://norsol.es,,Burgos,https://www.linkedin.com/company/norsol/,https://www.facebook.com/profile.php?id=61562085653709
Cambio Energético,S.l.u. Slu,B10481216,,+34 927 50 01 62,https://www.cambioenergetico.com,,Caceres,,
Energías Renovables Web ≫ ¿qué Son? Ejemplos Y Tipos,"Jac Digital Horizon, Slu",,,+34 634 16 01 60,https://www.energiasrenovablesweb.com,,Caceres,,
Empresa De Instalaciones Elã©ctricas En Cã¡ceres Y Espaã±a,"Ctricas De La Vera, S.l",,,+34 927 56 01 18,https://inselver.com,,Caceres,,https://es-es.facebook.com/inselver/
Fotovoltaicas Del Sur,,,,+34 688 10 78 23,https://fotovoltaicassur.com,,Caceres,,https://www.facebook.com/profile.php?id=61587659679129#
"Tensol, Energía Solar Y Renovables En Cádiz.",Y Marca Registrada “la Empresa” – El Cual No,B11736790,,+34 956 70 83 00,http://tensol.es,"Blank"">ctra. Arcos - El Bosque, Km 3, Junto A Venta Pajuelo, 11630 Arcos De La Frontera (cádiz",Cadiz,,https://www.facebook.com/tensol
☀️ Solar 21,Y Marca Registrada “la Empresa” – El Cual No,,,+34 956 70 10 28,https://solar21.es,,Cadiz,,
Geca Solar Cádiz: Energía Y Confort Eficientes,,,,+34 626 72 26 73,https://www.gecasolar.com,A 23 11130 Chiclana De La Frontera,Cadiz,,
Placas Solares En Sevilla,,,,+34 656 19 58 25,https://solrenovables.com,,Cadiz,,https://www.facebook.com/solrenovablesplacassolaressevilla
Placas Solares Cantabria,,,,+34 600 00 00 00,https://esolarcantabria.es,,Cantabria,,
Instalador Placas Solares En Cantabria,"Pelayo Ortiz, S.l",B13988936,,+34 679 13 02 69,https://www.solarcan.es,"Española De Protección De Datos, Domicilio En C/ Jorge Juan, 6, 28001-madrid Y Teléfonos De Contacto: 901 100 099 / 91 266 35 17",Cantabria,,
Eficecan,Eficecan Ingenieria S.l,B72947906,,+34 611 59 65 30,https://www.eficecan.com,,Cantabria,https://www.linkedin.com/in/adri%C3%A1n-cifri%C3%A1n-guti%C3%A9rrez-41ab7074/?originalSubdomain=es,https://www.facebook.com/eficecan.energia/
Contrata Las Placas Solares En Cantabria,,,,+34 645 78 92 76,https://fotovoltaicacantabria.com,3.org%2f2000%2fsvg%22%3e%0a%3cpath%20d%3d%22m16.0264%2012.3086l9.46387%200.90625c8.97168%200.0585938%207.68652%200.03125%207.19434,Cantabria,,
Instalación De Energías Renovables En Cantabria,,,,+34 699 92 95 54,https://www.icarus-solar.com,"S.google.com/maps?z=16&q=barrio%2bla%2batalaya%2c%2b43%2c%2b39120%2bmortera%2c%2bcantabria"" Target=""_blank"" Rel=""noopener Nor",Cantabria,,
Autoconsumo Solar Para Empresas,,,,+34 942 21 22 55,https://cantabricosolar.com,"Ar S.l.dirección: Pae Ibarrabarri, Pab. C-20 – 48940 – Leioa – Bizkaia – Españacorreo Electrónico",Cantabria,https://www.linkedin.com/company/bikote-solar/,
Instalación De Placas Solares Castellón,,,,+34 643 76 93 16,https://renotek.es,,Castellon,,
"Instalación De Energía Solar, La Martina Energía Solar En Castellón",,,,+34 704 62 81 77,https://www.energiasolarlamartina.com,,Castellon,,
Inicio,", Darth Vader Sl",B12788212,,+34 964 26 08 70,https://www.qlelectric.com,,Castellon,,
Instalaciones Solares Castellón,"Financial Solutions Management, S.l.",B19499417,,+34 621 17 36 27,https://www.yellowenergy.es,,Castellon,,
Placas Solares Y Energía Solar Fotovoltaica,,,,+34 744 70 20 13,https://www.evolucionsolar.es,"Promiso Hablamos ? Contacto Contacto Avenida De La Plata 43, Cp, 46013, Valencia España Info@evolucionsolar.es +34 960 106 308 Con",Castellon,https://www.linkedin.com/company/evolucion-solar/,https://www.facebook.com/Evolucion-Solar-103013052783347
Inicio,,,,+34 663 58 22 63,https://www.rnovaenergia.com,,Ciudad real,,
Placas Solares En Castilla,,B16282394,,+34 967 16 60 89,https://www.ecogalenergia.es,,Ciudad real,https://www.linkedin.com/company/ecogal-energ%C3%ADa/?originalSubdomain=es,https://www.facebook.com/ecogalenergiasl/?locale=es_ES
Ecorise,,,,+34 637 50 55 07,https://ecorise.com.ar,,Cordoba,https://www.linkedin.com/company/er-ecorise/about/?viewAsMember=true,
"Energía Solar Cordoba – El Futuro Es Solar. Vivilo Hoy. Somos Líderes En Instalaciones Fotovoltaicas Llave En Mano. Generá Tu Propia Energía, Ahorrá En Tus Facturas Y Sumate Al Cambio Sostenible",,,,+34 999 99 99 99,https://energiasolarcordoba.com,,Cordoba,,
Placas Solares En España,,,,,https://instaladores-energia-solar.com,,Cordoba,,
Iris Energía,,,,+34 613 13 36 04,https://irisenergia.com.ar,,Cordoba,https://www.linkedin.com/company/iris-energ%C3%ADa-inteligente/?viewAsMember=true,https://www.facebook.com/iris.energiasolar
Energía Solar En Córdoba,,,,+34 694 62 57 12,https://www.energiasolarcordoba.com.ar,,Cordoba,,https://www.facebook.com/energiasolarcordoba
· Energía Solar En Córdoba,,,,+34 694 62 57 12,https://sunflowersolar.com.ar,,Cordoba,,
Autoconsumo Solar Para Hogares Y Empresas,"Bexie Group, S.l",B56483332,,+34 985 19 42 32,https://bexieenergy.com,,Cordoba,https://es.linkedin.com/company/bexiegroup,
Ingeniería En Refrigeracion Industrial Córdoba,,,,,https://www.climaticasrl.com.ar,,Cordoba,https://www.linkedin.com/company/climaticasrl-argentina/,
Ilios Energías Renovables,,,,+34 995 11 23 38,https://iliosenergiasrenovables.com,,Cuenca,,
Obras Y Trabajos Â Encuentra Profesionales De Confianza Cerca De Ti,Tecomed Sda S.l,B73908030,,+34 633 02 63 62,https://obrasytrabajos.com,,Cuenca,,
Voltiva Energy,Oner S.l,B73817033,,+34 900 64 90 86,https://voltiva.energy,,Cuenca,https://www.linkedin.com/company/voltivaenergy/,https://www.facebook.com/profile.php?id=100046931507057
Paneles Solares Ecuador,,,,+34 694 62 57 12,https://placassolaresecuador.com,"Meta Property=""og:image"" Content=""https://pps.whatsapp.net/v/t61.24694-24/668118945_1310903437656464_4363176792609940197_n.jpg?ccb",Cuenca,,
Paneles Solares Pro: Expertos En Placas Solares【】,,,,+34 606 35 62 73,https://panelessolarespro.es,,Girona,,
Girona Select: Tu Guía Para Elegir Empresas En Girona,: Marc Restrudis –,,,,https://gironaselect.com,,Girona,,
Placas Solares Y Fotovoltaica En Girona,,B16917379,,+34 644 03 12 60,https://www.novasolaris.es,"17452 Massanes, Girona <",Girona,https://www.linkedin.com/company/nova-solaris-enginyeria-i-projectes/,https://www.facebook.com/novasolarisenginyeria/
Energía Solar Green Electric – Instalador De Placas Solares – Especialistas En Instalaciones Para Aprovechar La Energía Solar.,"Green Electric Energies Renovables, S.l",B65656308,,+34 972 64 10 10,https://www.greenelectric.cat,"308• Su Domicilio Social Está En: Calle Coll Y Vehí, 29 – 17100 La Bisbal D´empordà (girona)• Inscrita En El Registr",Girona,https://www.linkedin.com/company/green-electric-energies-renovables/,https://www.facebook.com/Greenelectricenergia
Solgetic,,B66447426,,+34 937 68 42 69,https://solgetic.com,,Girona,,https://www.facebook.com/people/Solgetic/100066516707897/
Instaladores Energía Solar Y Aerotermia En Girona,"Nucli Solar Plus, S.l",B17601915,,+34 972 65 55 48,https://nuclisolar.com,"Ucli Solar ), Amb Domicili Social A Carrer Areny 27, 17460 Areny Tlf: 972655548 I Correu Electrònic <a Hre",Girona,https://www.linkedin.com/company/nucli-solar,https://www.facebook.com/nuclisolar
Placas Solares En Granada,,,,+34 666 66 66 66,https://www.solargranada.es,"""streetaddress"": ""c. Motril, 238"", ""postalcode"": ""18220"", ""addresslocality"": ""albolote"", ""addressre",Granada,,
Solargranada,,,,+34 673 17 26 48,https://solargranada.com,,Granada,,
"Placas Solares Granada, Fotovoltaica Autoconsumo",,,,+34 636 21 06 54,https://santamariarenovables.com,,Granada,,
"Placas Solares En Granada, Autoconsumo Y Fotovoltaica",,,,+34 958 30 49 58,https://placassolaresgranada.com,,Granada,,
Jrfsun,,,,+34 627 00 67 94,https://jrfsun.com,,Granada,,
Soluciones Energéticas Granada,"Granada, S.l",B19703446,,+34 958 03 31 77,https://solugra.es,"Trong>domicilio Principal: Camino De Ronda, 208. Local, 18003 Granada (granada). Correo Electrónico /",Granada,,https://www.facebook.com/SOLUGRA/
Instalador Placas Solares 【expertos】【presupuesto Gratis】,Social11 S.l,B99429401,,+34 667 58 06 36,https://www.instaladorplacassolares.pro,,Guadalajara,,
Servicios Y Soluciones De Construcción En México,,,,+34 610 40 13 01,https://olisius.com,,Guadalajara,,
"Empresas, Ofertas Y Tiendas En Guadalajara","Comerleads, Sl",B85753614,,+34 910 14 98 22,https://guadalajara.infoisinfo.com.mx,"Y Domicilio En La Calle Alejandro González 5, 6º B, 28028, Madrid, O Mediante Comunicación Al Correo Electr&oa",Guadalajara,,https://www.facebook.com/infoisinfoMX
Instalación De Paneles Solares En México 🌞 Panelessolaresva,,,,,https://panelessolaresva.com.mx,,Guadalajara,,https://www.facebook.com/PanelesSolaresVaMexico
Soleare,Xxi S.l,,,+34 683 50 45 10,https://www.soleare.net,,Guadalajara,,
Paneles Solares En Guadalajara,,,,,https://emd-solar.com,,Guadalajara,,https://www.facebook.com/profile.php?id=61555655266345
Placas Solares En Madrid,Revolt Solar. Sl,B10870491,,+34 958 30 49 58,https://www.revoltrenovables.com,,Guadalajara,,
"Aerotermia, Placas Solares, Suelo Radiante, Aire Acondicionado En Gipuzkoa, Álava Y Bizkaia",,,,+34 613 08 02 12,https://www.gurener.com,"Th Fill-rule=""evenodd"" Clip-rule=""evenodd"" D=""m2.55806 6.29544c2.46043 6.19781 2.46043 6.03952 2.55806 5.94189l3.44195 5.058c3.539",Guipuzcoa,https://www.linkedin.com/in/gurener-energ%C3%ADas-renovables-951909251?utm_source=share&utm_campaign=share_via&utm_content=profile&utm_medium=ios_app,
Argisun Energías Renovables En Gipuzkoa,"Argisun, S.l",B20913042,,+34 943 86 19 95,https://argisun.com,,Guipuzcoa,,https://www.facebook.com/profile.php?id=100067763558461&locale=es_ES
Energías Renovables En Donostia,Renovables Sl,B20980918,,+34 943 10 28 00,https://ekilor.com,,Guipuzcoa,https://www.linkedin.com/company/ekilor-energ%C3%ADas-renovables-s.l./about/,
Gipuzkoa Energía,,,,+34 958 30 49 58,https://gipuzkoaenergia.es,,Guipuzcoa,,
Huelva Fotovoltaica,"Energias Renovables Y Climatizacion , S.l",B21499272,,+34 959 82 04 06,https://www.huelvafotovoltaica.com,"Elante “la Empresa”), Con Domicilio En Avda Nuevo Colombino N18, 21007, Huelva (huelva), Y Con Cif B21499272, Inscrita En El Regis",Huelva,https://linkedin.com/https://www.linkedin.com/in/climaonuba-huelva-609515158,https://www.facebook.com/profile.php?id=100061948034995
